{
  "$schema": "https://json-schema.org/draft/2020-12/schema",
  "title": "Sprint Task Manifest",
  "description": "Defines the tasks, dependencies, and metadata for a sprint. Used by the generate-playbook script to produce a deterministic playbook.md.",
  "type": "object",
  "required": ["sprintNumber", "sprintName", "summary", "tasks"],
  "additionalProperties": false,
  "properties": {
    "sprintNumber": {
      "type": "integer",
      "minimum": 1,
      "description": "The sprint number (e.g., 36)."
    },
    "sprintName": {
      "type": "string",
      "minLength": 1,
      "description": "Human-readable sprint name (e.g., 'Event Discovery & Social Features')."
    },
    "summary": {
      "type": "string",
      "minLength": 1,
      "description": "A 2-3 sentence summary of the sprint's goals, features, and business value."
    },
    "tasks": {
      "type": "array",
      "minItems": 1,
      "description": "A flat array of all tasks in the sprint. The script uses dependsOn to compute the execution graph.",
      "items": {
        "type": "object",
        "required": [
          "id",
          "title",
          "dependsOn",
          "persona",
          "skills",
          "model",
          "mode"
        ],
        "additionalProperties": false,
        "properties": {
          "id": {
            "type": "string",
            "pattern": "^[a-z0-9]+(-[a-z0-9]+)*$",
            "description": "A short, unique kebab-case slug (e.g., 'db-migrations', 'bugfix-login-redirect')."
          },
          "title": {
            "type": "string",
            "minLength": 1,
            "description": "Human-readable task title (e.g., 'Database Schema Migrations')."
          },
          "dependsOn": {
            "type": "array",
            "items": {
              "type": "string"
            },
            "description": "Array of task id strings this task depends on. Include ONLY direct, immediate dependencies. Do NOT include transitive dependencies (e.g. if C depends on B, and B depends on A, C's dependsOn should only include B). Empty array means no dependencies (eligible for concurrent execution)."
          },
          "persona": {
            "type": "string",
            "minLength": 1,
            "description": "The persona filename without extension (e.g., 'engineer', 'architect')."
          },
          "skills": {
            "type": "array",
            "items": {
              "type": "string"
            },
            "description": "Array of skill paths relative to .agents/skills/ (e.g., 'platform/cloudflare-workers')."
          },
          "model": {
            "type": "string",
            "minLength": 1,
            "description": "The model name string from models.json (e.g., 'Claude Opus 4.6 (Thinking)')."
          },
          "secondaryModel": {
            "type": "string",
            "minLength": 1,
            "description": "The fallback model name string from models.json (e.g., 'Gemini 3.1 Pro (High)'). Used if the user faces token limits."
          },
          "mode": {
            "type": "string",
            "enum": ["Planning", "Fast"],
            "description": "The agent execution mode."
          },
          "instructions": {
            "type": "string",
            "description": "Detailed, multi-line task instructions. MUST use '\\n- ' for bulleted formatting and line breaks to ensure readability. Optional for bookend tasks (isQA, isCodeReview, isRetro) — the script auto-injects workflow delegation commands and ignores any value provided here."
          },
          "scope": {
            "type": "string",
            "description": "Optional workspace scope hint (e.g., '@repo/api', '@repo/web'). Tasks sharing a scope at the same concurrency layer are grouped into one Chat Session."
          },
          "isIntegration": {
            "type": "boolean",
            "default": false,
            "description": "If true, the script injects the sprint-integration workflow delegation, acting as a merge step for feature branches before QA."
          },
          "isQA": {
            "type": "boolean",
            "default": false,
            "description": "If true, the script injects the plan-qa-testing workflow delegation instead of custom instructions."
          },
          "isCodeReview": {
            "type": "boolean",
            "default": false,
            "description": "If true, the script injects the sprint-code-review workflow delegation."
          },
          "isRetro": {
            "type": "boolean",
            "default": false,
            "description": "If true, the script injects the sprint-retro workflow delegation."
          },
          "isCloseSprint": {
            "type": "boolean",
            "default": false,
            "description": "If true, the script injects the close-sprint workflow delegation as the terminal bookend step that merges to main."
          }
        }
      }
    }
  }
}
