{
  "sprintNumber": 1,
  "sprintName": "Realtime Notifications",
  "summary": "Introduce realtime notifications via WebSockets across web and mobile platforms to replace manual dashboard refreshing.",
  "tasks": [
    {
      "id": "notifications-db",
      "title": "Database Schema Modifications",
      "dependsOn": [],
      "persona": "backend-engineer",
      "skills": ["sql", "migrations"],
      "model": "Claude Sonnet 4.6 (Thinking)",
      "mode": "Planning",
      "scope": "@repo/db",
      "instructions": "Create migrations for the new `notifications` and `notification_preferences` tables. Ensure foreign keys map to the `users` table correctly."
    },
    {
      "id": "websocket-server",
      "title": "WebSocket Infrastructure Setup",
      "dependsOn": ["notifications-db"],
      "persona": "backend-engineer",
      "skills": ["websocket", "redis"],
      "model": "Claude Sonnet 4.6 (Thinking)",
      "mode": "Planning",
      "scope": "@repo/api",
      "instructions": "Implement the `wss://api.example.com/events` endpoint. Handle JWT authentication upon connection. Wire up Redis Pub/Sub for cross-instance messaging."
    },
    {
      "id": "notifications-api",
      "title": "REST API Endpoints",
      "dependsOn": ["notifications-db"],
      "persona": "backend-engineer",
      "skills": ["nodejs", "express"],
      "model": "Gemini 3.1 Pro (High)",
      "mode": "Planning",
      "scope": "@repo/api",
      "instructions": "Implement endpoints to fetch history, mark notifications as read, and update user preferences."
    },
    {
      "id": "frontend-bell-ui",
      "title": "Notification Bell UI React Component",
      "dependsOn": ["notifications-api"],
      "persona": "frontend-engineer",
      "skills": ["react", "tailwind"],
      "model": "Claude Sonnet 4.6 (Thinking)",
      "mode": "Fast",
      "scope": "@repo/web",
      "instructions": "Create a `NotificationBell` component with an unread badge. Integrate it into the main navigation layout."
    },
    {
      "id": "websocket-client",
      "title": "WebSocket Client Connection Logic",
      "dependsOn": ["websocket-server"],
      "persona": "frontend-engineer",
      "skills": ["react", "websocket"],
      "model": "Claude Sonnet 4.6 (Thinking)",
      "mode": "Planning",
      "scope": "@repo/web",
      "instructions": "Implement a global hook to manage the WebSocket connection. Implement exponential backoff on disconnect. Listen for incoming `notification` events and update the global state."
    },
    {
      "id": "mobile-push-notifications",
      "title": "Mobile Push Notification Setup",
      "dependsOn": ["notifications-api"],
      "persona": "mobile-engineer",
      "skills": ["react-native", "push-notifications"],
      "model": "Claude Sonnet 4.6 (Thinking)",
      "mode": "Planning",
      "scope": "@repo/mobile",
      "instructions": "Integrate Firebase Cloud Messaging (FCM) to deliver notifications to iOS and Android devices."
    },
    {
      "id": "sprint-integration",
      "title": "Sprint 1 Integration",
      "dependsOn": ["frontend-bell-ui", "websocket-client", "mobile-push-notifications"],
      "persona": "engineer",
      "skills": ["architecture/monorepo-path-strategist"],
      "model": "Claude Sonnet 4.6 (Thinking)",
      "mode": "Planning",
      "isIntegration": true
    },
    {
      "id": "qa-testing",
      "title": "Sprint 1 QA Validation",
      "dependsOn": ["sprint-integration"],
      "persona": "qa-engineer",
      "skills": ["playwright", "testing"],
      "model": "Claude Sonnet 4.6 (Thinking)",
      "mode": "Planning",
      "isQA": true
    },
    {
      "id": "sprint-retro",
      "title": "Sprint 1 Retrospective",
      "dependsOn": ["qa-testing"],
      "persona": "product",
      "skills": ["architecture/markdown"],
      "model": "Claude Sonnet 4.6 (Thinking)",
      "mode": "Planning",
      "isRetro": true
    }
  ]
}
